{"name":"Mixed-source smoke test","targetEnvironment":"sandbox","services":[{"serviceId":"auth-service","action":"DEPLOY","build":{"sourceRef":"dev","username":"","version":"build-103"},"valuesOverlay":""},{"serviceId":"smtp-receiver","action":"DEPLOY","build":{"sourceRef":"release","username":"","version":"build-102"},"valuesOverlay":""}],"loadGenerator":{"templateRef":"smoke","virtualUsers":10,"requestsPerSecond":100,"warmupSeconds":1,"measurementSeconds":5,"configurationOverlay":""},"maxRunDurationSeconds":60,"thresholds":[{"metric":"latency_p95_ms","maximum":500,"required":true},{"metric":"error_rate","maximum":0.01,"required":true}],"simulationCase":"SUCCESS"}
